name,latitude,longitude,phone,address
CHAMUNDI PETROLEUM,19.215787,72.851158,9821140807,SWAMI VIVEKANAND ROAD OPP.POISAR BUS DEPOT BORIVALI MUMBAI 400 092
PATCO AUTO SERVICE,19.101038,72.839253,9819902727,398SWAMI VIVEKANAND ROAD VILE PARLE(W) INDIAN OIL DEALER
BON BON SERVICE CENTRE,19.104917,72.8864,9821165625,SAKINAKA ANDHERI (EAST) MUMBAI.
VELKAR AUTO,19.285109,72.901406,9820072485,VARSOVE VILLAGE NEAR GHODBUNDERNH NO.8 DIST. THANE.
GUJARAT SERVICE CENTRE,18.985243,72.830836,9322505410,IOC DEALERSNEXT TO KASTURBA HOSP. ARTHUR ROADSANE GURUJI MARG MUMBAI 400 011.
GARUDA AUTO SERVICE,19.205426,72.828019,9820046930,IOC DEALERS CHARKOP KANDIVALI (W) MUMBAI 400 067.
GOREGAON AUTO CENTRE,19.156906,72.856613,9821087119,IOC DEALERS GOREGAON MUMBAI.
INTERSTATE AUTOMOBILES,18.976545,72.843971,9820433060,123 REAY ROAD OPP.REAY RD STATION. P.D'MELLO RD MUMBAI 400 010.
I CARPORT,19.102837,72.873855,9821136657,IOC DEALERS SAHAR MUMBAI.
JOAQUIM PETROLEUM,19.044839,72.916371,9821052147,SION TROMBAY ROAD OPP. TELECOM FACTORY DEONAR MUMBAI.
NARAYAN FUEL STATION,19.032544,72.87774,9969198930,SURVEY NO.8PHASE I 120 FT ROADD P ROAD WADALA TT MUMBAI.
POONAM AUTO SERVICE,19.053312,72.88616,9769997209,SION TROMBAY ROAD SUMAN NAGAR CHEMBUR MUMBAI.
ROYAL SERVICE,19.109868,72.874031,9004214665,IOC DEALERS MAROL ANDHERI (E) MUMBAI.
SATYASHANTI AUTO SERVICE - DAHISAR,19.253891,72.866239,9930553552,IOC DEALERS DAHISAR MUMBAI 400 093.
VASANI SERVICE CENTRE,19.268952,72.878113,9820561406,MIRA VILLAGE DIST : THANE. MAHARASHTRA STATE. LOCK NO.12006
VENUS AUTO CENTRE,19.012977,73.107284,9821167011,IOC DEALER NATIONAL HIGHWAY DIST: RAIGAD.(LOCK NO. 21017)
HEERA PETROLEUM,18.8276,73.294377,9833822084,s.no.54/2b mumbai pune road KHALAPUR RAIGAD(LOCK NO.11013)
RAJ AUTO SERVICE,19.097016,72.839367,9821453175,18S.V.ROAD VILE PARLE ( WEST ) S V ROAD
SHREE KEDARNATH PETROLEUM,19.109346,73.065599,9215766070,"""PLOT NO.42/1 VILL-KIRAVALI"" ""TAL-PANVELDIST.RAIGADMAHARASHTRA"
FORT MOTOR EQUIPMENT CO,19.160061,72.858471,2222661814,INDIAN OIL DEALERS SURVEY NO: 589(A) VILLAGE PAHADI GOREGAON(W)
LUCKY AUTO,19.031519,72.860161,9820421550,292 KOMMRADE HARBANSLAL SION EAST KOLIWADA MARG MUMBAI
SHRI KRISHNA AUTOMOBILES PVT.LTD.,18.987982,72.814056,9821219561,DR ANNIE BESANT ROAD WORLI BOMBAY
DRONAGIRI SERVICE CENTRE,18.892375,72.975831,9819211502,DRONAGIRI NOD URAN DIST. RAIGAD
PUSHPAK AUTO & GAS STATION,19.13944,72.864881,8268618546,OPP MAJAS BUS DEPOT JOGESHWARI VIKHROLI LINK ROAD JAGESHWARI (E) MUMBAI 60
3-STAR FUEL STATION,19.066569,72.866872,9820465458,"3-STAR FUEL STATION ""PLOT NO C-50 G BLOCK BANDRA-"" ""COMPLEXBANDRA EAST MUMBAI"""
SAHIL SERVICE CENTRE,18.80027,73.294168,9764869171,"""OPP.BHUSHAN STEELVILLAGE NIFAN ""KHOPOLI-PEN ROAD DISTT. RAIGAD"""
PRAKASH EXPRESSWAY FILLING STATION,18.790611,73.299609,9820954554,MUMBAI-PUNE EXPRESSWAY SANJGAON TALUKA KHALAPUR DISTT.RAIGAD.
GURUPRASAD SERVICES,19.182011,72.846715,9833331777,S V ROAD MALAD EAST MUMBAI
SHAHID YOGESH PATIL AUTOMOBILE,19.04646,73.074917,9892218387,PLOT NO: 8 SECTOR: 14 KHARGHAR DISTT.RAIGAD
HEERA ASSOCIATES,19.174222,73.114645,9819335445,SURVEY NO. 158 HISSA NO. 1 KHONI TALUKA: KALYAN District Thane
GUPTA SERVICE STATION-MOTI BAGH,28.57766667,77.1749,9810118027,Moti Bagh South MOTI BAGH NEW PALAM ROAD lok no 329
DRIVEWELL SERVICE STATION,28.676517,77.31425,9811027361,G.T ROAD SHAHDARA DELHI-95
SUPER AUTO CENTRE,28.56773333,77.25395,9810002650,SRINIVAS PURI RING ROAD NEW DELHI lock no. 364 NEW DELHI
SHANKAR AUTOMOBILES,28.631023,77.205624,9871184354,GOLE MARKET lock no 359 NEW DELHI
SHIVAN AUTO CENTRE,28.6217,77.30148333,9999900304,MAYUR VIHAR PHASE II DELHI
GAY SERVICE STATION,28.703433,77.181085,9810154076,GT KARNAL ROAD INDL.AREA AZADPURDELHI TELE.7139349 Opp. Hans Cinema
SETHI AUTO S/STN-MANGOLPURI,28.697023,77.112654,9810125134,NEAR JAIPUR GOLDEN HOSPITALROHINI OUTER RING ROAD MANGOL PURI. NEW DELHI
BEE GEE MOTORS,28.836615,77.097169,9818443807,DSIDC Complex NARELADELHI-40 TEL.5693307 DELHI
FARIDABAD SERVICE STATION,28.389194,77.312431,9899912291,18/4 Mathura Road Faridabad 18/4 Mathura Road Faridabad DISTT FARIDABAD
AJIT MOTORS,28.59705,77.1356,9837015258,GOPINATH BAZAR DELHI CANTT. NEW DELHI
AKAASH AUTO CENTRE,28.640207,77.285149,9910783500,INDIAN OIL PUMP LAXMI NAGAR NEW DELHI
ASSOCIATED TRADING CO,28.652585,77.155946,9999999090,PATEL NAGAR OPP.SHADIPUR DEPOT NEW DELHI NEW DELHI
AUTO YARD,28.53755,77.28466667,9811043394,8/1 MILE STONE ( LOCK 91) MATHURA ROAD DELHI
CHANAKYAPURI SERVICE STATION,28.666963,77.09199,9899123771,OUTER RING ROAD ROAD NO.26 PACHIM VIHAR DELHI
ENGINEER SERVICE STATION,28.586921,77.212117,9654262692,NEAR SAFDARJUNG AIRPORT AURBINDO MARG NEW DELHI
FORTUNE SERVICE STATION - ROHINI,28.727378,77.142789,9811314040,SEC 19 ROHINI NEW DELHI. LOCK CODE - I - 374
HUNDRED PERCENT,28.578699,77.059527,8826886999,SECTOR-9 OPP. NHAI OFFICE DWARKA NEW DELHI. LOCK NO 330
JINDAL SERVICE STATION,28.5623,77.2663,9810121271,MATHURA ROAD NEAR TELEPHONE EXCHANGE NEW DELHI.
KAILASH SERVICE STATION,28.55863333,77.24063333,9810007495,EAST OF KAILASH NEW DELHI-65 LOck NO 335 NEW DELHI-65
KANPUR DELHI GOODS CARRIER LTD,28.701626,77.290256,9891238833,LONI BORER LOCK ID 805 LONI ROAD DELHI DELHI.
KAPUR AUTO SERVICE STATION,28.62495,77.30533333,9212155886,EAST OF VINOD NAGAR lok no 336 PATPARGANJSOCIETY AREA DELHI- LOCK ID NO. I 336
KISHORE & COMPANY,28.50128333,77.28888333,9811154298,LOCK ID NO.I338 IOC DEALERMB ROAD NEW DELHI
MANSAA,28.659632,77.296829,9810212101,PLOT NO 25A lok no 340 CBD SHAHADRA DELHI PH.2438318
PRAGATI,28.641304,77.229068,9711144917,JAWAHAR LAL NEHRU MARG OPP RAMLILA GROUND LOCK ID NO. I 344
QUEENS ROAD SERVICE STATION,28.56006667,77.1699,8700893618,VASANT VIHAR OUTER RING ROAD VASANT VIHAR N DELHI LOCK ID NO. I 346
QUTAB SERVICE STATION,28.53461667,77.19628333,9811021862,OPP STC & MMTC HOUSING COLONY MEHRAULI RD N DELHI MEHRAULI N.DELHI
R K SERVICE STATION,28.583255,77.191744,9811080862,OPP. CHANAKYA CINEME YASHWANT PLACE NEW DELHI
R.K.AMAR SAHEED SERVICE STATION,28.711555,77.110142,9213731531,DDA COMMUNITY CENTRE SECTOR-6 ROHINI NEW DELHI
RAJASTHAN HIGHWAY SERVICE STATION,28.518014,77.081336,9811038654,GURGAON ROAD KAPASHERA BORDER DELHI. TEL.LOCK NO 348
RAJASTHAN RAJPATH FILLING STATION,28.52475,77.101001,9599414443,NATIONAL HIGHWAY NO.8SAMALKHA N DELHI. LOCK NO 349
ROHIT SERVICE STATION,28.856947,77.124211,9810517863,22/4SINGHU BORDER G T KARNAL ROAD DELHI LOCK CODE - I-565
SABARWAL SERVICE STATION,28.56495,77.1776,9718393560,R K PURAM NEW DELHI SECTOR V
SHIVALIK SERVICE CENTRE,28.5979,77.065,9873100006,DWARKA SECTOR-2 PHASE-I NEW DELHI LOCK ID NO. I 554
SPEEDWAYS SERVICE CENTRE,28.62333,77.101619,9810540137,JAIL ROADNEAR HARI NAGAR DEPOT lock no 363 (ISSUE SEALS)
TULI MOTORS,28.653121,77.123739,9717433339,RAJA GARDENRING ROAD FOR PREMIUM LOCK NO 988 BIJWASAN LOCK CODE - I - 390
VAISH FILLING STATION,28.614247,76.980488,9811047727,NANGLOI RD NAJAFGARH DELHI LOCK ID NO I 563
CAPT AMIT SERVICE STATION,28.62257,77.110507,9310166066,HARI NAGAR Ghantaghar Road DELHI
JAI BANGLAMUKHI ECO FUEL STN.,28.688945,77.104278,9810858371,NO.43SERVICE CENTRE S-18 OF H4&H5 ZONE PITAMPURA
MANGAL PETRO,28.688727,77.104723,9212728729,SITE NO. 2 SERVICE CENTRE ROAD S-18 ROAD NO. 43 PITAMPURA NEW DELHI
MADHAV FUELS,28.608684,76.953295,9917091626,DHANSA ROAD MITRAON NEW DELHI NEW DELHI
IOC COCO JUNGPURA,28.587063,77.241387,9991196544,JUNG PURA NEW DELHI LINK ROAD NEW DELHI
JAI AUTOMOBILES,28.63673584,77.44326928,9810133850,NEAR VIJAYNAGAR CROSSING NH-24 GHAZIABAD UP
RAMA SERVICE STATION,28.71056667,77.45623333,9999445893,INDIAN OIL DEALER 23.7MEERUT ROAD.MORTA DISTT.GHAZIABAD.
NOIDA AUTOMOBILES,28.585752,77.309298,9810633790,POLT NO B -567 SECTOR - 14 NOIDA-201 301 GAUTAM BUDH NAGAR
PADAM PETROLEUM,28.624502,77.374954,8860088743,PLOT NO - PP 1 SECTOR - 63 NOIDA-201 307 GAUTAM BUDH NAGAR
SHEETAL AUTOMOBILE S/STN,28.561199,77.339063,9911911239,PLOT NO - PP 1 SECTOR - 44 DSC ROAD NOIDA - 201 301
SHIV SERVICE STATION,28.70485566,77.63974382,9312200313,INDIAN OIL DEALER NEAR SHRIRAM HOSPITAL41KM DELHI HAPUR RDPILKHUWA-GHAZIABAD
TYAGI SERVICE STN.,28.65892,77.353841,9311113827,VILLAGE PRAHLADGARHI NH-58 GHAZIABAD UP
SHIVA MOHAN SERVICE STATION,28.425495,77.604355,9810868734,GANGOLA SURAJPUR KASNA ROAD GANGOLA 203207 UTTAR PRADESH
DAUJI SERVICE STATION,28.678657,77.485326,9958033002,VILL HARSAON PARGANA DASNA GHAZIABAD
RAM MURTEE FUELS,28.541034,77.153783,9818369369,VASANT KUNJ OPP GRAND HYATT NEW DELHI
RUKMANI SERVICE STATION 18038507,28.666482,77.481548,9871962950,INDIAN OIL RETAIL OUTLET NH-24 MEHRAULI HAPUR BY PASS ROAD GHAZIABAD UTTAR PRADESH
MAHENDRA,28.6618,77.30036667,9899940004,CBD SHAHDARA NEAR SURAJMAL PARK CBD SHANDRA NEAR SURAJ MALL PARK DELHI.
PARAS AUTOMOBILES,28.531431,77.062644,9891050302,"""VILLAGE BIJWASAN"" KAPASHERA - BIJWASAN ROAD ND DELHI"
RISAL PETRO,28.732709,77.198521,9899249866,VILLAGE JHARODA MAJRA OPP STA TPT AUTHORITYBURARI ROADNEW DELHI DELHI
ARIHANT SERVICE CENTRE,28.683255,77.509706,9313116481,DASNA NH-24 ADHYATMIK NAGAR GHAZIABAD
RAJIV FILL & DRIVE,28.587311,77.351475,9873077777,SECTOR-33 OPP NTPC BUILDING NOIDA-201301 GAUTAM BHUDHA NAGAR
TYAGI BROS. FILLING STN.(IBP RO),28.61928,77.483833,9810074210,GT ROAD CHAPRAULA-201302 GAUTAM BUDH NAGAR
CHANDRA PRAKASH & SONS,28.353783,77.556587,9719062622,IBP PETROL PUMP NOIDA GAUTAM BHUD NAGAR
DELHI DIESELS,28.702695,77.266047,9212582106,B-3 yamuna vihar main wazirabad ro Delhi DELHI-110053
BHARAT SERVICE STATION,28.854299,77.124594,9312832339,SINGHU BORDER G.T. KARNAL ROAD DELHI-110040 DELHI
MOTOR ADES,28.639385,77.173933,8800798989,DR K.S KRISHNAN ROAD NEAR NPL PUSA INSTITUTE PUSA ROAD NEW DELHI
AMISH ENTERPRISES,28.756114,77.147799,9811159609,LIBASPUR KHASRA NO.21-25 G.T. KARNAL ROAD LIBASPUR DELHI-42
SAVITA FILLING STATION,28.586105,77.260671,9873479677,BEHLOLPUR OUTER RING ROAD SARAI KALE KHAN BUS TRMNL. N.DELHI
MOTOR CENTRE,28.702972,77.192553,9810054387,MALL ROAD OPP ALPANACINEMA MALL ROAD DELHI DELHI.
CAR CARE,28.57078333,77.16345,9212013010,SECTOR 8 R.K. PURAM NEW DELHI-22 R.K. PURAM New Delhi
AJAY SERVICE STATION,28.67678333,77.32173333,9810300247,SHAHDARA NEW SHAHDARA BORDER G.T. ROAD SHAHDARA DELHI-32
RUCHIKA SERVICE STATION,28.60358333,77.3358,9810234471,KUNDLI GHAROLI KONDLI GHARAOLI NEAR MAYUR VIHAR PH-III NEW DELHI-96
AUTOFUEL,28.68852,77.112965,9811156457,ROAD NO.43 GURU HARKISHAN MARG NEAR SARASWATI VIHAR TELEPHONE EXCH PITAMPURA DELHI-34
SATBIR FILLING STATION,28.533834,77.107049,9811066601,IGI AIRPORT NH-8 DELHI JAIPUR ROAD RANGPURI N.DELHI
ROOP FILLING STATION,28.698278,77.313533,9814027207,WAZIRABAD WAZIRABAD ROAD U.P.BORDER NEAR GAGAN CINEMA DELHI
SINGH SERVICE CENTRE,28.6966,77.2915,9810003990,LONI BORDER LONI ROAD. FC SHAHDARA DELHI-93 DELHI.
LOTUS AUTOMOBILES,28.50426667,77.17168333,9910311899,ANDHERIA MOR MEHRAULI GURGAON ROAD ANDHERIA MEHRAULI N.DELHI
SINGH MOTOR CENTRE,28.738175,77.149327,9810036566,A-3 PHASE - I SANJAY GANDHI TRANSPORT NAGAR NEW DELHI
KESHAV MOTORS,28.398112,77.311482,9811663374,18/1 MATHURA ROAD FARIDABAD OPP. CROWN PLAZA DISTT FRIDABAD
SHREE SHYAM PETRO CARE,28.418935,76.997956,9350819030,NARSINGHPUR NH-8 GURGOAN NARSINGHPUR NH-8 GURGOAN DISTT GURGAON
BADUS PETRO,28.54315,77.066567,9312272457,VILLAGE BHARTHAL F-28 PUSHPANJALI DWARKA LINK ROAD NEW DELHI.
JAINSONS FILLING STATION,28.235882,77.069072,9215667015,SONEPAT NEAR SECTOR 14-15 CROSSING DISTT SONEPAT 131001
GURU SERVICE STATION,28.591123,77.037605,9811057170,SECTOR 12 DWARKA NEW DELHI NEW DELHI
GANGA PETRO,28.57917,77.055404,9810440007,SECTOR 10 DWARKA NEW DELHI DELHI
PRIYANKA SERVICE STATION,28.725063,77.125704,9811112311,DISTRICT CENTRE II SECTOR 13 NEW DELHI
CH. RAMCHANDRA SINGH BHATI & SONS,28.543677,77.563518,9971596889,IBP PETROL PUMP GAUTAM BUDH NAGAR
SWATI SALES CORPORATION,28.981042,77.030392,9416863232,D - 2 INDUSTRIAL AREA SONEPAT - ROHTAK ROAD SH 20 DISTT SONEPAT
SWATI SALES CORPORATION,28.981042,77.030392,9416863232,D - 2 INDUSTRIAL AREA SONEPAT - ROHTAK ROAD SH 20 DISTT SONEPAT
INDRAPURAM AUTO FUELS & SERVICES,28.632889,77.351129,9818580181,INDRAPURAM DISTRICT GHAZIABAD Indrapuram Ghaziabad
SAI RAM SERVICE STATION,28.721112,77.109498,9810629786,3/B-4 DISTICT CENTRE 1 NEAR RITHALA METRO STN ROHININEW DELHI-85
SRI BALAJI PETRO RETAILING,28.625486,76.993157,9243066670,VILLAGE DICHAUN KALAN NAZAFGARH-NANGLOI ROAD NEW DELHI
CITY AUTO,28.71625,77.117604,9810218885,PLOT NO. 1-A-3 DISTT CENTRE-I SECTOR-10 ROHINI DELHI - 110085
CHAUDHARY SERVICE STATION,28.730016,77.183393,9911150814,DHEERPUR NEAR MUKUDPUR CHOWK NORTH OF RING ROAD
GLOBAL PETRO,28.570168,77.186387,9810930007,BHIKAJI CAMA PLACE RING ROAD NEW DELHI
R.N. PETRO CARE,28.778597,77.045111,9810275485,VILLAGE-POOTH KHURD DELHI BAWANA ROAD DELHI-110039
CITI FUELS,28.622736,77.095593,9811044233,JANAKPURI OPP.-VIRENDER NAGAR NEAR BHARATI COLLEGE NEW DELHI
JRO,28.49642,77.4865981,7303069750,PLOT NO. 41 SURAJPUR KASNA ROAD UDYOG VIHAR OPP. MOSER BAER GREATER NOIDA
MM FILLING STATION,28.952192,77.094599,9416778888,INDIAN OIL PETROL PUMP VILL: ASAWARPUR ON NH-1 DIST: SONEPAT
ISHWAR FILLING STATION,28.530438,77.454106,9990135373,OPP HOLLAND TRACTOR FACTORY GREATER NOIDA GAUTAM BUDH NAGAR
MKR HIGHWAY FILLING STATION,28.841044,77.263999,9319854166,INDIAN OIL DEALER VILLAGE- KHEKHRA DELHI- SAHARANPUR ROAD
SUPER FUEL AND FUN POINT,28.8946446,77.6220902,9336022223,DEALER- INDIAN OIL CORPN VILLAGE MOHIDDINPUR NH-58
M/S VARDHMAN PETROLEUM,28.715619,77.461485,8010567272,DEALER- INDIAN OIL CORPN DELHI- MEERUT ROAD VILLAGE MORTA
24 HOUR FILLING STATION,28.430176,77.036119,9818679055,BETWEEN RAJIV CHOWK & SADAR THANA CHOWK ON SOHNA ROAD Islampur Distt Gurgaon
K B S MOTORS,28.49784,77.628434,9412859814,DELAER INDIAN OIL VILLAGE LUHARLI BETWEEN KM STONE 43-47 NH-91
YADU FUELS,28.65250584,77.36849836,7011682619,KHASRA NO. 675 SUCHETA KRIPALANI MARG Shakti Khand-III
ONKAR FILLING STATION,29.100329,77.281251,9837577406,INDIAN OIL DEALER VILL- PATTI BAZIDPUR TEHSIL- BARAUT
EHSAAS FILLING STATION,28.960171,77.1019,9910401222,VILLAGE-BAHALGARH ON KHEWRA ROAD SONEPAT
SHRI SHUBHAM FILLING STATION,28.86701806,77.54617049,9760202000,INDIAN OIL DEALER VILLAGE - NEWARI DEHAT Dist- Ghaziabad
NAMAN ENTERPRISES,28.786206,77.040606,9810499933,KH. NO: 178/14 SAMAYPUR BADLI TO BAWANA ROAD VIA POOTHKHURD
NCR FILLING STATION,28.699083,77.6025,9999505884,INDIANOIL DEALER VILLAGE LAKHAN BETWEEN KM STONE 36 & 38 NH-24
OM SAI FILLING STATION,26.815455,83.871672,9415213319,PLOT NO. PP-01 GH-03 SECTOR-16C GREATER NOIDA(WEST) NOIDA EXTENSION
KASANA MOTORS,28.436741,77.556577,9818945427,PLOT NO. P-01 SECTOR ECOTECH(I) EXTENSION GREATER NOIDA
GURGAON FUEL CENTRE,28.4648,77.037383,7838222319,BETWEEN MAHAVIR CHOWK & MAHARANA PR CHOWK ON MG ROAD GURGAON(LHS) District Gurgaon
ANURAG PETROLEUM,28.717334,77.462471,9810318665,DHARGAL BETWEEN KM STONE 20-24 GHAZIABAD
CH. KESHRAM SHYAMO AUTO FUELS,28.528689,77.456519,9810232544,INDIAN OIL PETROL PUMP HABIBPUR TEHSIL DADRI
COCO-III,28.466044,77.5334885,9560237222,PLOT NO. PP-01SECTOR-PI GREATER NOIDA GAUTAM BUDH NAGAR
COCO-II,28.6076507,77.441432,9711169571,PLOT NO. PP-01SECTOR-16B GREATER NOIDA(WEST) GAUTAM BUDH NAGAR
AMAR SHAHID SUDISH FILLING STATION,28.820292,77.101286,9719564426,NEAR FIRE STATION NARELA-ALIPUR ROAD DELHI
IOC COCO SECTOR 19 DWARKA,28.577338,77.053401,9205501446,SECTOR 19 DWARKA DELHI
MOHAN FILLING STATION KSK,28.292283,77.419811,9718450506,VILLAGE ATELI OML BLOCK BALLABHGARH District Faridabad
ANAND FUEL CENTRE,28.638787,77.458025,9810866632,B-34/1 SITE-1 INDUSTRIAL AREA
SETHI AUTO S/STN,28.544977,77.121947,9873249717,NH8 MAHIPALPUR DELHI NH8 MAHIPALPUR DELHI DELHI
LILA SERVICE STATION (I-449),22.502616,88.331257,9433112460,62BURO SHIBTALA MAIN ROAD KOLKATA-700038 KOLKATA
TARA MAA SERVICE STATION,22.22827,87.900719,9836246767,VILL-IRKHA PO-BORAKAMARDANH-41 PS- NANDKUMAR PURBA MEDINIPUR
GOLDER SERVICE STATION,22.676529,88.790611,8250532691,MATIAHAT MOUZA - JOYPUR GOPEMAHAL Dist. 24 Paraganas(North)
CHAMPIAN HUB,22.57763872,88.46206695,8820818377,PLOT NO.CF-19 PREMISES NO.05-240 AA-I New Town Kolkata
RAJU SERVICE STATION,22.693049,88.744349,9732924344,VILL-PASCHIM BIBIPUR PO-BEGAMPUR PS-BASIRHAT Dist. North 24 Parganas
SAHA SERVICE STATION (ADHOC),22.4368,87.8572,9811914908,COCO KOLAGHAT KHARISHA KOLAGHAT (NH- 6) PURBA MEDINIPUR
NATIONAL SERVICE STATIONHOSUR,12.748159,77.807951,9443377750,INDIAN OIL DEALERS BANGALORE ROAD SIPCOT HOSUR. LOCK NOS 1101222008
GAYATHRI FUELS,12.708649,77.81688,9443222224,Indian Oil Dealers 714/3A Rudrappa Colony. Hosur-Denkanikottai Road NO:13018
SURYA PUTHRA PETRO STATION,12.944137,77.529144,8028601770,INDIAN OIL DEALERS SY No 16 PANTHARPALYA RING ROAD KENGERI HOBLI BANGALORE 39
ABHIMAANI FUEL STATION,13.023345,77.51020333,9880601023,PLOT No. 460B IVTH PHASE PEENYA INDL. AREA NALAKADARANAHALLI VILLAGE
GSN FUELS,12.747125,77.83356,9443141688,GSN FUELS KRISHNAGIRI DISTRICT NGO COLONY BAGALUR ROAD HOSUR
POPULAR FUEL SERVICE,12.725991,77.854292,9442265061,MORNAPALLIMARUTI NAGAR NH-7KRISHNAGIRI MAIN RD HOSUR HOSUR
M.M. AGENCIES,12.649813,78.035268,9566901354,INDIAN OIL DEALERS NH-7 GOLLAPALLI VILLAGE SOOLAGIRI KRISHNAGIRI DISTRICT
SRI VEERABHADRASWAMY PETROLEUM,12.581781,77.431064,9980774326,AGRAHARA VILLAGE CHATRA NH-209 KANAKAPURA RD RAMNAGARAM DIST. RAMANAGARAM DISTRICT
SKYLINE FUELS,13.31055,77.126877,9886333023,IOC DEALER TUMKUR RING ROAD SETTYHALLI GRAMA TUMKUR - 572103
NISARGA SERVICE STATION,14.34139861,74.88517194,9481869832,IOC DEALERS SY NO116 1 YLHALLI TAVAREKERE PO NANDHAGUDI HOBLI hobli
SRI DURGA ENTERPRISES,13.077609,77.796036,9945222159,SURVEY NO 103 OLD MADRAS RD HOSKOTE BANGALORE RURAL DISTRICT
SRI DURGA ENTERPRISES,13.077609,77.796036,9945222159,SURVEY NO 103 OLD MADRAS RD HOSKOTE BANGALORE RURAL DISTRICT
SRI LAKSHMIVENKATESHWARA FUELS,13.04158,77.761002,9845625936,INDIANOIL DEALERS GORAVIGERE GATE BANGALORE RURAL DISTRICT
SRI LAKSHMIVENKATESHWARA FUELS,13.04158,77.761002,9845625936,INDIANOIL DEALERS GORAVIGERE GATE BANGALORE RURAL DISTRICT
SHAKTI GANAPATHI FUEL STATION,13.11909167,77.63312472,9880752629,INDIAN OIL DEALERS SY NO.6/3(6/2) KATTIGENAHALLI VILLAGE JALA HOBLI BANGALORE
BETTEGOWDA SERVICE STATION,13.2152,77.553,9008849497,INDIAN OIL DEALERS SY.NO.91KADATHANAMALE VILLAGE HESSARGHATTA HOBLI BANGALORE
RANJITH SERVICE STATION,12.7135,77.7052,8792216876,INDIAN OIL DEALERS SY.NO.72/6HALDENAHALI VILLAGE ANENKAL TALUK BANGALORE
FUEL ZONE,13.14052,77.61795528,9845356717,SY NO.7/1 HUNSAMARANEHALLI VILLAGE JALA HOBLI
RV CLASSIC FUELS,12.601585,78.124455,8148876077,INDIAN OIL DEALER NH-7 KURUBARAPALLI VILLAGE KURUBARAPALLII POST
DVR AND SONS,12.9045,77.74655,9611999975,IOC PETROL PUMP SY NO 73 4 VARTHUR SARJAPUR ROAD VILL. HEGGONDANAHALLI
DVR AND SONS,12.9045,77.74655,9611999975,IOC PETROL PUMP SY NO 73 4 VARTHUR SARJAPUR ROAD VILL. HEGGONDANAHALLI
SAINATH SERVICE STATION,17.33915,78.5678,9392695999,IOC DEALERS PLOT NO. 2 & 3 NH 9 VANASTHALIPURAM TELANGANA
SRI SAINARSIMHA FUELS,17.3259,78.4773,9849553344,INDIAN OIL DEALERS SRISAILAM ROAD HYDERABAD TELANGANA
KAILASH FILLING STATION,17.367484,78.557522,9666643934,INDIAN OIL DELEARS SY. NO.102/3/B NAGOLE UPPAL (M) TELANGANA
G.M.R.FILLING STATION,17.314849,78.459056,9391038600,SY. NO.83 MYLARDEVPALLY VILLAGE RAJENDRANAGAR MANDAL RR DIST. TELANGANA
NACHARAM FILLING STATION,17.440968,78.565083,9000725580,SY. NO.51 NACHARAM IDA NACHARAM RANGA REDDY DIST. TELANGANA
SRI BALAJI KAILASH F/S HASTINAPUR,17.32988,78.55328,9848023030,S.NO.58/1/G BAIRAMALGUDA HASTINAPUR COLONY RANGA REDDY TELANAGANA
EXPRESS WAY FUEL STATION,17.597209,78.056173,8688001833,INDIAN OIL DEALER SY NO. 210(PART)MALKAPUR(V) TELANGANA
STAR QUALITY FUEL STATION,17.515249,78.479651,9963377767,INDIAN OIL DEALER SY NO. 91 PETBASHEERABAD VILL. MEDCHAL MALKAJGIRI DISTRICT
SUPERINTENDENT DIST JAILSANGAREDDY,17.552233,78.117443,9494632158,INDIAN OIL DEALER KASIPUR (V) SY NO.114/14DIST JAIL KASIPUR KANDI MANDALSANGA REDDY DIST.
BAGGA HIGHWAY SERVICES,23.1768,72.5738,9979151107,ADALAJ AHMEDABAD SH 41 AT ADALAJ DIST. GANDHINAGAR
GUJARAT STATE CIVIL SUPPLIES(GSCS),23.2331,72.6695,6359945727,KALPATARU FILLING STATION SECTOR 21 GANDHINAGAR 382021 DIST. GANDHINAGAR
ISHWAR PETROLEUM,23.0293,72.475,9824049620,BLOCK NO.303 AMLI-BOPAL ROAD AHMEDABAD.
JAYVIR CIVIL PETROL PUMP,23.0489,72.6048,9747640999,INDIAN OIL DEALER 39 KM OPP.NEW CIVIL HOSPITAL AHMEDA DIST.AHMEDABAD. TEL:375078
MANSA PETROLEUM SALES & SERVIC,23.4246,72.6494,9925226588,INDIAN OIL DEALER OPP. MANSA MARKETING YARD DIST. GANDHINAGAR
MANIAR AUTO CENTRE,22.981,72.5856,9824265935,INDIAN OIL DEALER AHMEDABAD-BOMBAY NH8 DHANILIM AHMEDABAD DIST.AHMEDABAD.
PRINCE GASOLINE,23.167,72.6371,9925126548,AIRPORT ROAD KUDASAN GANDHINAGAR
SIDDHACHAKRA PETROLEUM,23.1618,72.5881,9429128489,INDIAN OIL DEALER ADALAJ - AHMEDABAD SH 41 GANDHINAGAR
SHARDA PETROLEUM SERVICE,23.1141,72.5838,9824387777,INDIAN OIL DEALER CHANDKHEDA DIST.AHMEDABAD PIN 382 424 TEL: 2329137723296777 23298877
VISAT AUTOMOBILES MOTERA,23.0973,72.5891,9825036651,INDIAN OIL DEALER MOTERA DISTT. AHMEDABAD
AMBICA SERVICE STATION,22.7156,72.4648,9726635999,IOC DEALER DHOLKA KHEDA ROAD DIST. AHMEDABAD (185)
SUN PETROGAS,23.0305,72.6142,8128177516,SARASPUR AHMEDABAD AHMEDABAD
RUPAM PETROLEUM,23.0397,72.5956,9327008803,"""OPP.DARIAPUR GATENR IDGAH CHO"" "" DARIAPUR AHMEDABAD"""
BHAKTI PETROLEUM,23.0251,72.6763,9825069252,E-358/359 GVMMLIMITED ODHAV ROAD NH 59 ODHAV AHMEDABAD
KALASHREE AUTOMOBILES,22.8672,72.4577,9979096655,S.NO. 493 VILLAGE BHATH TALUKA DASCROI DISTRICT AHMEDABAD
PUNJAB SERVICE STATION,23.0462,72.6017,9726933777,IBP DEALERBALIA LIMDI NEW CIVIL ROAD DIST:AHMEDABAD
SACHA SAUDA SERVICE STN PVT.LTD,23.022,72.6506,9898010062,PLOT NO 467 GIDC ESTATE ODHAV ROAD AHMEDABAD
UNIQUE RETREADS PVT. LIMITED,22.9746,72.639,9870389494,PLOT NO. 635/B GIDC PHASE 4 VATVA AHMEDABAD
ACCURATE FILLING STATION,23.1251,72.5828,9879526230,SURVEY NO.202/1&23 PARTY CHANDKHEDA S H NO 41 TAL DIST GANDHINAGAR
SHREE LAXMINARAYAN AUTOMOBILES,22.938,72.4558,9979864104,SARKHEJ-BAVLA ROAD NH 8A CHANGODAR DISTT. AHMEDABAD
SHRI SAHAJANAND PETROLEUM,23.3497,72.6435,9859881281,IBP DEALER MANSA GANDHINAGAR ROAD SH 71 DIST.GANDHI NAGARBALWA
ASHIRWAD ENTERPRISE,22.8031,73.0502,9879516635,INDIAN OIL PUMP AT&POST. ALINA TAL. MAHUDHA DIST. KHEDA DIST. KHEDA
RATHWA PETROLEUM,23.0785,72.6886,9898257332,SURVEY No. 31 VILLAGE : BILASIYA TALUKA : DASCROI
FIRST CHOICE(IOCL PETROL PUMP),22.7055,72.8593,9898851111,CITY SURVEY NO 1245 NUTAN TILE NADIAD -KAPDWANJ ROAD NADIAD DIST. KHEDA
RAJ PETROLEUM SERVICES,23.4394,72.3944,9824063527,STATE HIGHWAY NR. NIRMA FACTORY AT & POST : MANDALI DIST. MEHSANA
KAMESHWAR PETROLEUM,23.0575,72.5563,9998844823,NR. KAMESHWAR TEMPLE ANKUR CHAR RASTA AHMEDABAD -
DEV PETROLEUM,22.3,73.4006,9825122539,NEAR BOPAL JUNCTION S. P. RING ROAD AMBLI AHMEDABAD
ASHATVINAYAK PETROLEUM,22.9104,72.7054,8735007474,VILL. HIRAPUR TAL. DASCROI HIRAPUR TO HATHIJAN CIRCLE Ahmedabad
KRUSHN PETROLEUM,22.8894,72.9908,9879232793,SURVEY NO. 832+836 PAIKI MOUJE & TAL. KATHLAL Dist. Kheda
CHENPUR PETROLEUM,23.0962,72.5601,9824631680,GST-CHENPUR ROAD AT. CHENPUR NEW RANIP AHMEDABAD
AADIT PETROLEUM,23.0475,72.5551,9978788808,NEAR DARPAN SIX CROSS RAOD NARANPURA AHMEDABAD CITY
VIDITA PETROLEUM,23.0083,72.6149,9909708809,OPP. ASHIMA MILLS BEHIND ANUPAM CINEMA KHOKHRA AHMEDABAD
DEV GANESH PETROLEUM,23.1615,72.6974,9824098339,SURVEY NO. 2 SHRAM MARG VILLAGE : PHIROZPUR GIFT CITY GANDHINAGAR
GUJARAT AUTO SHAHWADI,22.9744,72.5624,7925714692,INDIAN OIL DEALER OPP.PIRANA OCTROI NAKA SHAHWADI AHMEDABAD.
Shri Balaji Petroleum,18.66475775,73.77017037,9923019995,Plot No.55S. No.23 Transport Nagari Nigdi Dist. Pune
ABC INDIA LTD,18.71864,73.669727,8805980037,TALEGAON(DABHADE)PUNE MUMBAI ROAD TALUKA MAWAL DIST PUNE
JYOTI PETROLEUM,18.492411,73.83407,9960736119,PLOT NO 545/2 PARVATI SINHAGARH ROAD TALUKA HAVELI DIST PUNE
MAHADEVI PETROL DEPOT,18.758936,73.828704,9822064488,Survey No.251/1(part) SH No.55 KharabwadiChakan TAL KHED DIST-PUNE
PIMPLE PETROLEUM,18.632769,73.799956,9822064640,C S NO. 4695 GAT NO.29 NH4PIMPRI TAL- HAVELI DIST : PUNE
SAI SAMARTHA PETROLEUM,18.569735,73.817155,9960001515,S.NO. 13\1 1+2 PLOT NO. 3 SPICER COLLEGE ROAD SHITOLE NAGAR SANGVI DIST PUNE
SHAHID LT.COL.PRAKASH PATIL PET,18.457827,73.829102,9028001606,S.NO.6/16 AT AMBEGAON BUDRUK DEHU-KATRAJ BYEPASS ROAD PUNE- PIN CODE 411 046
JAYESH PETRO SERVICES,18.760851,73.471296,9923222223,GAT NO. 490 NH4 MTDC RESORT KARLA TAL MAVAL DISTRICT PUNE
SARHAAN PETROLEUM,18.627504,73.852653,9130989989,S.NO.198 HISSA NO.1. PUNE NASIK ROAD BHOSARI TAL HAVELI DIST PUNE.
MAULI PETROLEUM KSK,18.613064,73.941317,9763414444,VILL - LOHEGAON LOHEGAON-VADGAON SHINDE ROAD TALUKA - HAVELI DISTT PUNE
DUDHANE PETROLEUM,18.468675,73.785349,9764210100,GAT NO 93 VILLAGE SHIVANE TALUKA HAVELI DIST PUNE
REGAL PETROLEUM,18.682075,73.82599,8999669247,GAT NO 63 CHIKHALI MOSHI ROAD PIMPRI CHINCHWAD TALUKA HAVELI DIST PUNE
RAJLAXMI PETROHUB,18.594634,73.729386,9822887505,SURVEY NO.257/1/C VILLAGE HINJAWADI TALUKA MULSHI DISTRICT PUNE
KAJALE & SONS (HSD),18.658625,73.849503,9822067927,NEAR OLD MOSHI OCTROI POST VILL MOSHIPUNE-NASHIK RD DIST PUNE
ARIHANT PETROLEUM,20.9462,72.9616,9426881341,INDIAN OIL DEALER IOC DEALER OPP : POWER HOUSENH8 KABILPORE-396424 NAVSARI.
DHANSUKHLAL C.SHAH,21.2579,73.3102,9925155000,At & Post Mandvi Mandvi MANDVI DIST.SURAT
GANDEVI TALUKA K.S.SANGH LTD,20.8182,72.996,9879758003,IOC DEALERS GANDEVI GANDEVI DIST. NAVSARI
JAI PETROLEUM,20.9329,72.9141,9824156968,IOC DEALER DANDI ROAD VIJALPORE TAL : VIJALPORE DIST :NAVSARI GUJARAT.
KRISHNA PETROLEUM,21.1796,72.8334,9925151000,IOC DEALERS UDHNA SURAT UDHNA
V.D.PATEL & COMPANY,21.3002,72.9541,9428743881,NH-8 AMBOLIAMBOLI PO. KATHOR TA SURAT. SURAT.
WADIWALA AUTOMOBILES,21.1162,73.104,9925161000,Ten At & Post Bardoli NH6 TEN BARDOLI SURAT.
SAI PETROLEUM,21.0974,72.8714,9825141441,BLOCK NO. 381SURVEY NO. 415 VILLAGE SACHIN TAL. CHORYASI SURAT
