name,latitude,longitude,phone,address
SHANTILAL & SONS,21.1936,72.8539,9925411777,SURVEY NO.58-P & 66-P UMARWADA SURAT CITY SURAT
NEELAM PETROLEUM,23.3455,73.0766,7096588930,INDIAN OIL DEALER CITY SURVEY NO. 4574TPS NO.3 FP NO. 144 KATARGAM
CENTRAL AUTO FILLING STN,20.7801,73.3563,9426801455,INDIANOIL DEALER AT HANUMANBARI TAL HQ.BANSDA NH56 DIST-NAVSARI GUJARAT
NITYAKRUPA SERVICE STATION,20.9602,73.172,9426884229,MAHUVA ANAVAL ROAD PO KARCHELIA TAL MAHUVA DIST. SURAT
SAHYOG PETROLEUM,21.0753,72.8884,9726133366,"""BLOCK NO.243/2/P VIL. LAJPORE"" NAVSARI ROAD DIST. SURAT NAVSARI ROAD DIST. SURAT"
THE PURUSHOTTAM FARMERS COOP.C,21.2362,72.79,9879750501,"INDIAN OIL DEALER ""SURVEY NO. 1/2/A 1/2/B BLOCK' ""JAHANGIRPURA TAL: CHORYASI SURAT"
J B D FUEL & SERVICE,21.1096,73.1341,9427151298,"INDIAN OIL DEALER ""S. NO.1/PAIKI 1 BLK NO.1 TAJPORE KHURDTLK.BARDOLIDIST. SURAT"
Shakti Petroleum,23.5551,70.6451,9825365344,Survey No.13/B & 114 Pandesara Unn Jakatnaka Nr. Daksheshwar Mahadev Mandir
PRASHANSHA PETROLEUM,20.99184,73.02494,9724160006,SURVEY NO.465 VILL: SUPA ON NAVSARI BARDOLI ROAD TAL: NAVSARI DIST: NAVSARI
JAY BABRIK KISAN SEVA KENDRA,21.2128,72.9391,9427709142,INDIAN OIL DEALER SURVEY NO.62+80 BLOCK NO.79 Vill: Kosmada Tal: Kamrej
ANKIT PETROLEUM,20.7811,73.0849,9925140316,SURVEY NO. 16451646 & 1647 VILL: ALIPORE ON SH-15 Dist: Navsari Tal: Chikhli
SHANTABA PETROLEUM,21.2737,72.964,9719012008,INDIAN OIL DEALER SURVEY NO.503 BLOCK NO.486 Vill: Kamrej Tal: Kamrej
MAA KRUPA PETROLEUM,22.4047,72.9054,9409402424,INDIAN OIL DEALER SURVEY NO.2615 VILL: KUKERI Tal: Chikhli Dist: Navsari
POOJA PETROLEUM,20.9454,72.9668,9586255999,INDIAN OIL DEALER SURVEY NO. 188 VILL:KABILPORE Dist: Navsari
ANAND PETROLEUM,21.5816,70.0375,9731190977,INDIAN OIL DEALER SURVEY NO.119/A+119/B Vill: Utran Dist: Surat
SAHAJANAND PETROLEUM,21.34,70.2477,9428836761,INDIAN OIL DEALER SURVEY NO.74 VILL:NADOD Tal:Jalalpore Dist: Navsari
GURUASHISH PETROLEUM,21.2708,72.8465,9879382228,INDIAN OIL DEALER SURVEY NO.978-979B. NO 926 Variav- Surat City
SHARDA PETROLEUM,20.97,72.9318,9825114835,INDIAN OIL DEALER SR/B NO.482 HISSA NO 1 TO 4 15 Bhaktinagar Vijalpore
SHIV KRUPA PETROLEUM,21.3254,72.9437,9978444414,INDIAN OIL DEALER BLOCK NO.2/A VILL: ANTROLI Tal: Kamrej Dist: Surat
SHREY PETROLEUM,21.1345,72.8894,9428869099,INDIAN OIL DEALER B NO.48/A VILL: SANIYA KHANDE Tal: Choriyasi Dist: Surat
PINDESHWAR PETROLEUM,21.2589,72.6687,9879241121,INDIAN OIL DEALER BLOCK NO.442VILL: PINJRAT Tal: Olpad Dist: Surat
BUDDHESHWAR FILLING STATION,26.837517,80.844369,9335281700,NEAR RING CROSSING MOHAN ROAD LUCKNOW
KALAWATI FILLING STATION,26.798986,81.009026,9415046485,AHIMA MAULUCKNOW-SULTANPUR ROAD LUCKNOW UP
PANKAJ SERVICE STATION,26.874046,80.86448,9415002503,LUCKNOW- HARDOI ROAD NEAR DUBAGGA NEAR DUBAGGA LUCKNOW
RKBK - BAKSHI KA TALAB,26.975874,80.923596,8756402018,LUCKNOW SITAPUR ROAD BAKSHI KA TALAB LUCKNOW
INDRA AUTOMOBILES,27.876553,78.075668,9872260043,ASHIANA COLONYNEAR POLICE STATION BANGLA BAZAR LUCKNOW
AKMDS FILLING STATION,26.62113,81.004762,9415022719,VILLAGE KANKAHA MOHANLAL GANJ RAEBAREILLY ROAD DISTT. LUCKNOW
VERMA AUTOMOBILES,26.9107,80.9484,9793221133,ALIGANJ SCHEME FAIZABAD ROAD-SITAPUR ROAD BYPASS LUCKNOW
S.S.FILLING STATION,26.706533,80.837448,9451954656,ON LUCKNOW - KANPUR ROAD NH25 BANTHRA TEHSIL:SIKANDERPUR LUCKNOW
ANKUR FILLING STATION.,26.664654,80.807365,9045714710,BANTHARA DISTRICT : LUCKNOW
COCO GOMTINAGAR,26.866389,80.996389,9956870507,VIBHUTI KHAND GOMTI NAGAR LUCKNOW
